title,context
智联与千峰教育举办IT专场双选会,"11月24日,由智联招聘联合千锋教育主办的“乘锋破浪·联接未来”冬季IT专场双选会在北京举行。 此次招聘共邀约包含中电金信、拓尔思在内的30家企业参会,为到场800余名求职者累计提供岗位300余个。招聘岗位涵盖嵌入式、C/C++、前端开发、jav"
千锋教育到底好不好,在过去的十年间，千锋教育通过自身的不断努力，共孵化成功六个子品牌，千锋IT特训营、扣丁学堂、好程序员、小狮视觉、锋企优联、锋云智慧分别代表千锋在IT职业教育，在线教育，高端IT职
千锋教育怎么样,"职业教育是就业为导向的教育类型,千锋教育在不断提升培训服务品质的过程中,更是以坚持抓过程、严管理、重企业、盯结果的服务原则,打造了十大就业服务体系,包含了严格的标准化管理体系、"
"千锋教育济南校区,汇聚教育力量,铸就非凡未来","随着移动互联网的迅猛发展,互联网人才需求越来越大,千锋教育济南校区应运而生。作为千锋教育济南校区的校长,周保健先生始终坚守在教育一线,以严谨的教学态度、丰富的行业经验和对教育的"
"太原千锋教育:聚力教研、教学,以“工匠精神”培育新时代人才","近年来,随着国内教育行业的快速发展,太原作为北方重要的经济中心和历史文化名城,也迎来了教育产业的高速崛起。在这个过程中,千锋教育太原校区作为新兴教育力量,不断拓展业务范围,提升教"
"千锋教育郑州校区:汇聚行业人才,成就学员梦想","在这个背景下,千锋教育郑州校区应运而生,成为了互联网行业人才培养的摇篮。作为一家专注于IT技术培训的教育机构,千锋教育郑州校区始终坚持以学员为本,以服务为核心,致力于为学员提供高"
"千锋副总裁陈川:要发挥教育机构职业教育优势,西安校区多措并举...","陈川:千锋教育可以发挥教育机构、企业的教育培训经验优势,让学生掌握实用技能同时,为高校学子们提供技术讲座、就业指导讲座,助力学生掌握一技之长,找到合适的工作;还可以在校园内设立企"
"千锋教育青岛校区,以实力赢得市场认可的教育机构","千锋教育青岛校区自成立以来,始终坚持以质量求生存,以口碑求发展,以实力赢得市场认可,成为了青岛地区受欢迎的IT培训机构之一。 作为一所专业的IT培训机构,千锋教育青岛校区拥有一支技术"
"千锋教育副总裁陈川:发挥教育机构优势,助力学生掌握一技之长",陈川：千锋教育可以发挥教育机构、企业的教育培训经验优势，将先进技术、教学经验、项目经验、就业指导经验
千锋教育王晓军受邀参加计算机软件测试员国家职业技能标准初审会,千锋教育王晓军老师受邀参加“计算机软件测试员”国家职业技能标准初审会（右二）为确保国标开发工作顺利实施，特召开此次“计算机软件测试员”国标开发工作项目初审会。中国就业培训技
千锋教育鸿蒙(HarmonyOS)开发教程:开发准备,千锋教育鸿蒙（HarmonyOS）开发教程：开发准备 本文档适用于HarmonyOS应用开发的初学者。通过构建一个简单的具有页面跳转/返回功能的应用（如下图所示），快速了解工程目录的主要文件，
"千锋教育CEO宁老师新年贺词:拥抱变革,向上而生!",时节如流，岁月如梭，2023年到来了，千锋也将步入发展的第十三个年头。12年来，全体千锋人在“成为一个有情怀、有良心、有品质的一流教育机构”的企业愿景指导下，秉承着草根、创业、协
千锋联合华为开发者联盟学堂打造品质课程 为技术从业者职场赋能,"职业教育肩负着技术技能型人才培养和促进就业的重要职责,是广大青年打开通往成功成才大门的重要途径,千锋教育作为一家职业教育机构,一直以来通过开源分享泛IT类优质课程,积极推动技术赋"
"千锋深耕职业教育12年,向上而生,沐光前行",师资管理是确保品质的关键，在管理体制上，千锋在全国采用统一的师资培养标准，考核后上岗，录取率不到2%，为了确保全国校区师资力量的平衡，千锋教育在全国范围内统一培养，统一调配师
千锋全国高校“双师型”IT骨干教师寒假高级研修班即将开启,"HTML5大前端方向由千锋教育大前端教研总监陆老师担任主讲,陆老师具备20年IT行业从业经验,曾任去哪儿网前端架构师,主导去哪儿网在线服务频道Hybrid App开发,项目与教学经验丰富,享有“陆"
千锋教研院执行院长王蓝浠:教育是一项心怀大爱的事业,"央广网北京12月7日消息 “有教无类,因材施教”,千锋教研院秉持这个理念在职业教育领域深耕近12载。千锋教育非常重视教研教学,在成立之初便创建了千锋教研院,每年数千万投入教研教学,致"
"解码行业前景,奔赴职业薪起点,好程序员开放日京东总部游学","近日,好程序员“解码行业前景,奔赴职业薪起点”开放日活动邀请了全国各大院校即将毕业的学子来到好程序员北京校区参观学习,在科技企业走访环节,好程序员Java学科总监陈老师和千锋教育大"
千锋教育的口碑怎么样,"相信你对千锋教育有一定的了解,不过还是那句话,眼见为实耳听为虚,大家还是多了解、多试听比较好。想要了解更多课程内容可以私一下,在线零距离接触千锋教育大咖名师,让你轻松从入门到精"
"千锋教育宁高磊:深化职业教育产教融合,服务好广大学子、高校和企业","千锋教育秉承教育初心,坚持面授品质,打造了全国统一的教学标准体系,学员无论在哪个校区学习,都可以享受到同等优质的教学服务。截至目前,千锋已与全国600余所高校建立合作关系;与教育部"
"“培养数字化人才,护航大学生就业”千锋教研院2022年教研战略发布...","千锋教育院校合作部总监顾巍连线发言(左一)(企业供图,央广网发) 千锋教研院2022年教研战略发布会,千锋与政府、高校、企业等代表在培养数字化人才和促进大学生就业方面进行了广泛而深入"
